{
  "$schema": "http://json-schema.org/draft-07/schema#",
  "$id": "http://example.com/product.schema.json",
  "title": "textAdventure Game Database",
  "description": "A game database for textAdventureJS",
  "definitions": {
    "action_definition": {
      "description": "Defines what happens if a verb is used (with this object / in this location)",
      "type": "object",
      "required": ["text", "commands"],
      "properties": {
        "text": {
          "type": "array",
          "items": {
            "type": "string"
          }
        },
        "commands": {
          "type": "array",
          "items": {
            "type": "string"
          }
        }
      }
    }
  },
  "type": "object",
  "properties": {
    "general": {
      "description": "General Information about this tbe database",
      "type": "object",
      "properties": {
        "title": {
          "type": "string"
        },
        "author": {
          "type": "string"
        },
        "version": {
          "type": "string"
        },
        "request": {
          "anyOf": [
            {
              "type": "string"
            },
            {
              "type": "array",
              "minItems": 1,
              "items": {
                "type": "string"
              }
            }
          ]
        },
        "start": {
          "$ref": "#/definitions/action_definition"
        }
      },
      "parser_parser_ignored_words": {
        "description": "Words that will be ignored when parsing an user input. This prevent that they get interpreted as verbs or objects (Note: Thus objects and names can't have this as on of their 'words')",
        "type": "array",
        "items": {
          "type": "string"
        }
      },
      "parser_error_text": {
        "type": "string"
      },
      "parser_unknown_verb_text": {
        "type": "string"
      },
      "required": [
        "title",
        "author",
        "version",
        "request",
        "start",
        "parser_ignored_words",
        "parser_error_text",
        "parser_unknown_verb_text"
      ]
    },
    "verbs": {
      "description": "List of verbs that are available throughout the game",
      "type": "object",
      "additionalProperties": {
        "type": "object",
        "required": ["failure", "words", "standalone_action"],
        "properties": {
          "failure": {
            "description": "Shown if the verb is used with an unknown object or the object does not define this action.",
            "type": "string"
          },
          "words": {
            "description": "Alternative words that the player may use",
            "type": "array",
            "items": { "type": "string" },
            "minItems": 1,
            "uniqueItems": true
          },
          "standalone_action": {
            "description": "Run if the verb is used without an object.",
            "$ref": "#/definitions/action_definition"
          }
        }
      }
    },
    "objects": {
      "description": "List of objecs that are available throughout the game",
      "type": "object",
      "additionalProperties": {
        "type": "object",
        "required": ["words", "locationDescription", "actions"],
        "properties": {
          "words": {
            "description": "Alternative words that the player may use",
            "type": "array",
            "items": { "type": "string" },
            "minItems": 1,
            "uniqueItems": true
          },
          "locationDescription": {
            "type": "string"
          },
          "actions": {
            "description": "List of verbs that can be used with this object and what should happen",
            "type": "object",
            "additionalProperties": {
              "$ref": "#/definitions/action_definition"
            }
          },
          "useableObjects": {
            "description": "List of possible combinations",
            "type": "object",
            "additionalProperties": {
              "$ref": "#/definitions/action_definition"
            }
          }
        }
      }
    },
    "locations": {
      "description": "List of locations that are available throughout the game",
      "type": "object",
      "additionalProperties": {
        "minProperties": 1,
        "type": "object",
        "required": ["objects"],
        "properties": {
          "objects": {
            "description": "List of objects in this location",
            "type": "array",
            "items": {
              "type": "string"
            },
            "uniqueItems": true
          }
        }
      }
    }
  },
  "required": ["general", "verbs", "objects", "locations"]
}
